address,city,compname,contents,education,industry,jobgood,jobname,jobway,month,salary,size,url
",杭州",杭州,杭州数梦工场科技有限公司,"职位描述：工作职责1、配合团队实现业务场景2、大数据开发3、编写开发文档4、其他算法方向研究及开发工作""任职资格1、统计、数学、计算机等相关专业，硕士以上学历2、熟悉java、C、python等语言的一种，熟悉机器学习3、掌握oracle、mysql等一种数据库开发，熟悉sql4、较强的逻辑思维能力以及算法实现能力5、具有良好的沟通能力和团队合作精神""",硕士,计算机/互联网,职位诱惑：岗位津贴，福利补贴，技术大牛，弹性工作，氛围轻松，团队年轻；,数据分析实习生,4天／周,实习10个月,150-300／天,500-2000人,https://www.shixiseng.com/intern/inn_u4ibazjdpm6n
北京,北京,律动乐器,职位描述：岗位职责：1、针对业务部门相关的数据进行统计、整理、分析，并提出对策方案；2、支持、配合各部门工作，及时提供各种需求报表。任职条件：1、熟悉电脑操作，熟练运用word和excel等办公软件；2、有较强的数据分析能力，能定期对相关数据进行有效分析，并根据数据分析结果对项目方案提出改进建议；3、责任心和上进心强，有良好的职业道德和团队合作精神，对工作充满热情，具有敏锐的思维能力。,不限,电子商务,职位诱惑：员工旅游、提供住宿、五险、全勤奖、节日福利,数据分析实习生,5天／周,实习4个月,140-150／天,150-500人,https://www.shixiseng.com/intern/inn_m8vzrhjpceym
上海,上海,滔搏运动,职位描述：岗位职责：1、定期向公司所属各大区收集汇总整理相关业务数据；2、协助主管对收集的信息、合同资料进行整理归档。岗位要求：1、大专以上学历，统计、市场相关专业2、学习能力强，认真细致，沟通能力良好。3、大三大四学生均可。,本科,贸易/物流,职位诱惑：年轻朝气的团队，发展空间大,数据分析,5天／周,实习10个月,120-140／天,2000人以上,https://www.shixiseng.com/intern/inn_pbxbk9gtpvcj
上海,上海,西部证券,职位描述：该职位接受暑期实习&长期实习。岗位职责：1、负责消费、电商等相关行业数据的收集，整理，清洗检验和分析，对数据进行建立相关数据库并定期跟踪；2、对基础数据的可靠性有基本判断并作简单分析，挖掘相关行业细分领域相关上市公司标的，进行长期跟踪监测，对跟踪的数据可表达一定的观点和分析建议。任职要求：1、全日制本科大二大三或研一在读，每周到岗至少3天；2、有数学、统计、金融等相关行业经验优先；3、学习能力和执行力强，较强的信息搜集能力和数据处理能力，熟练使用Excel、Word、PPT等工具，较强的逻辑概括、文字和语言表达能力，对数据有较强的敏感性；4、能够写简单的SQL查询语句或者会用R或Python做数据处理优先。,本科,金融,职位诱惑：券商平台,实习数据分析,4天／周,实习3个月,40-80／天,15-50人,https://www.shixiseng.com/intern/inn_rmu7fcvnqigh
上海,北京,FESCO,职位描述：岗位职责：1、数据收集和处理2、将数据集成到公司数据系统中。3、管理连锁药店和月度预测流程。4、每周发布DDI等日常报告。5、与现场和市场部门紧密合作。任职要求1、熟练使用Excel办公软件，熟练使用word、PowerPoint等软件。2、良好的沟通和人际交往能力。3、能够同时管理多项任务和期限。4、大学本科或以上5、良好的英语听说读写能力，有英语托业成绩优先；,本科,企业服务,职位诱惑：百强外企,数据分析实习生,5天／周,实习4个月,100-150／天,2000人以上,https://www.shixiseng.com/intern/inn_ksgaek6aggwd
北京,北京,绿色和平,职位描述：申请流程此招聘公告长期有效，开放招聘的实习生职位滚动录取，录满为止。在申请邮件正文中建议包含（1）通过何种渠道获得实习信息，（2）想来绿色和平实习的原因和期待，（3）过往的环保经历或以后的计划，（4）若第一志愿岗位无法满足后的其它志愿岗位（请查看我们的其他在招实习生岗位）。录用流程：发送简历――电话沟通――安排面试――面试通过――开始实习我们未必第一时间回复每一封邮件，但有兴趣的我们不会遗落，请理解。数据分析部分致力于通过对数据的处理、分析及可视化，为绿色和平各个项目提供支持。工作内容：1.传播分析：-协助微信、微博、新闻等传播数据的收集和处理；-为传播运营提供相关渠道分析；-协助传播相关的内容分析；2.数据处理：-协助处理项目相关数据及可视化能力要求：1.良好的中英文听说读写能力2.细心、耐心，沟通能力强3.学习能力、执行能力强4.专业不限，计算机、数据科学、统计专业优先工作时间：每周2-3天。能连续工作3个月或以上者优先考虑。关于我们绿色和平成立于1971年，目前在50多个国家和地区开展工作。绿色和平通过独立调查来揭示污染的严峻与急迫，更凝聚多方力量，共同推动相关政策法规与企业环境表现的改善。逾40年“勇于行动、独立敢言”的鲜明特征让绿色和平成为全球最具个性的环保组织。我们永远奋斗在环保第一线，现在邀请你一起加入绿色活动，感受保护地球的快乐。你将获得100元／天的实习津贴＋实习证明，足够优秀还有推荐信，更重要的是，你还会：与充满灵感和创意的环保伙伴一起工作，感受行动带来的乐趣在温馨开放的工作氛围，感受自由空间中的灵感迸发了解国际NGO的运营，深入接触不同类型的行业领袖和环保机构在行动中探索自己，激发潜能，实现个人能力的突破,大专,NGO,职位诱惑：通过对数据的处理、分析及可视化，为绿色和平各个项目提供支持。,数据分析部门实习生,2天／周,实习10个月,50-100／天,50-150人,https://www.shixiseng.com/intern/inn_czussscbrhfb
北京,北京,奔驰,职位描述：工作内容：1.以产品信息、运营状况和价格预测等为基础，协助完成产品分析报告2.每月定期更新产品、价格和市场相关的数据分析及报告3.与公司其他部门同事合作、与外部供应商沟通，推动项目进程4.部分行政工作，如预订会议室、差旅报销等职位要求：1.实习期间必须保持学生身份2.沟通能力强，优秀的英语书面和口语能力3.熟练使用办公软件：Excel，PowerPoint等4.注重细节，处理数据和面对数字要耐心和细心5.有团队精神，适应多元化工作氛围工作时间：一周五天全职，能保证六个月实习期。7月底到岗工作福利：1.免费班车从芍药居和望京西地铁站接送2.每月税前工资3000RMB3.饮料水果无限供应,本科,"其他,机械制造",职位诱惑：工作内容充实，学习机会多，可涉及产品全方位信息,V级车及威霆运营部-数据分析实习生,5天／周,实习6个月,120-150／天,500-2000人,https://www.shixiseng.com/intern/inn_wzvnxxizwzsf
"深圳,",深圳,PKFARE比客,职位描述：岗位职责：参与公司数据分析建模工作；任职资格：1、重点大学本科以上学历，计算机专业，统计学，金融工程等专业；2、对数据敏感，逻辑清晰，擅长于数据模型的建立；3、学习能力强，英语优秀优先考虑。,本科,计算机/互联网,职位诱惑：完善的培训体系  棒棒的福利 大牛领导,助理数据分析师,5天／周,实习3个月,150-200／天,150-500人,https://www.shixiseng.com/intern/inn_iikxix4cdhhn
北京,北京,亚马逊中国,"职位描述：需要实习6个月，每周5天。AmazonseeksaSalesandOperationplanninginterninSupplyChainteam.ThispositionwillbelocatedinAmazonCNheadquartersandwillcorporatewithupstreambusinessteam,downstreamwarehouseandtransportationteamandotherrelatedteamtodoshortandmid-termvolumeplanning.ThecandidateisexpectedtobefamiliarwithbasicSupplyChainprocessandOperationsResearchknowledgeanddrivepositivechangeacrosstheorganization.Jobdescription-In-timecommunicationwithbusinessteam,warehouseandotherinternalteamstomanageFCdailycapacity.-Assistcountrylevelmidtolongtermforecastgeneration-Participateinprojectsthatcontributetotheteam'soverallefficiencythroughprocessimprovement,modellingetc.-PerformotheradhoctasksperassignedBasicqualifications-Candidatewillhaveabachelorormasterdegreeincomputerscience,statistics,supplychain/operationsresearchorbusinessadministration;-StrongproficiencyinMicrosoftExcelansSQL;-Outstandinganalytical,problemsolvingskills;-StrongoralandwrittencommunicationskillsinEnglish;-Couldworkunderpressure;-Internshipforatleastsixmonthsandfivedaysperweek.Preferredqualifications-ProficiencyinVBAorRisabigplus-Haveexperienceinsupplychainplanning,businessanalysisorproductionplanning职位介绍：协助维护每周的KPI报告，与库房协调管理日常capacity。协助从数据仓库提取数据支持Planningteam相关项目。技能需求：计算机相关专业如计算机科学与技术，软件工程，信息管理专业或者是精通编程技术的统计，数学相关专业的本科生或者硕士生；供应链管理相关专业・MSExcel和SQL是必须具备的技术・对数据仓库，大数据，商业智能等概念有了解，最好会使用一种BI工具・良好的书写和沟通能力・具有独自分析探索解决问题的能力",不限,互联网,职位诱惑：平台高，能学到东西,数据分析实习生-供应链方向,4天／周,实习7个月,149-150／天,500-2000人,https://www.shixiseng.com/intern/inn_si5kee9mjr4g
深圳,深圳,私募排排网,职位描述：岗位职责：1、负责与各大证券、期货、专户、私募机构、第三方平台进行产品、净值、联系方式的对接，包含产品、净值对比差异对接；2、负责配合净值人员、产品人员给出的反馈，及时对接机构（私募、证券、期货等等），保证公司、人物、产品、净值数据的完整性；3、负责配合部门做好数据质量工作，包含公司、人物、产品、净值等数据的完善；4、负责周期性关注中国基金业协会动态（政策、备案公司、产品、人物）；5、积极配合质检人员做好数据的完整性、准确性、及时性工作；任职要求：1、本科及以上学历，金融、经济、营销类等相关专业；2、具有良好的沟通能力，谈吐清晰，沟通思路顺畅。,本科,金融,职位诱惑：发展空间大 团队氛围好 能学到东西,数据分析,5天／周,实习4个月,120-200／天,150-500人,https://www.shixiseng.com/intern/inn_mugum0ff1ms9
北京,北京,贤达四方,职位描述：1、本科以上学历，计算机、数学、统计学等相关专业；2、深刻理解大数据分析原理及相关应用；3、熟练掌握主流数据库技术；4、精通数据分析、挖掘工具与方法，如SAS、R、Python、EXCEL等；5、敏锐的数据观察和分析能力，及时发现和分析其中隐含的变化和问题并给出建议；6、良好的沟通能力和团队精神，较强的学习能力，能承担一定的工作压力。,本科,计算机/互联网,职位诱惑：从事铁路行业大数据的开创性工作,数据分析师,5天／周,实习3个月,100-150／天,15-50人,https://www.shixiseng.com/intern/inn_yjpurzgteit0
重庆,重庆,德勤全球交付中心,职位描述：数据分析与信息管理实习生定向培养主要作为旨在培养技术类咨询人才，因此所选学员必须有志于从事数据分析、大数据技术方面的工作，招收专业可以覆盖各大院校的信息管理、软件工程等IT专业。将在2019年毕业的在校生，主要专业为信息管理、软件工程等IT专业毕业后无读研究生或出国打算毕业后计划留在重庆就业2018年暑假开始可以进入德勤全勤实习外语水平良好，通过CET-4入职前部门将提供系统的培训项目，包括以下方向：BI商务智能数据分析介绍与产品开发-BIEE；大数据处理与数据管理-Informatica；创新型数据可视化分析-Tableau；大数据平台介绍与入门-Cloundera；RPA财务机器人的介绍与应用-OCR/Uipath；,不限,企业服务,职位诱惑：培训完善  专业团队,AIM-数据分析与信息管理实习生,5天／周,实习3个月,99-100／天,2000人以上,https://www.shixiseng.com/intern/inn_xkhs0fzoy3h5
北京,北京,百分点科技,"职位描述：岗位职责：1.	对业务所需数据进行挖掘提取及加工，挖掘数据中的潜在价值；2.	负责对部门重点业务进行业务分析,包含客户分析、产品分析、精准营销分析等；3.	根据分析结果，为相关业务提出改进意见并撰写专业分析报告任职资格：1.	重点大学研究生在读（非应届毕业生），金融类、数学/统计类、计算机类相关专业，优先考虑；2.	熟悉银行业务，具备电子银行和互联网金融知识，优先考虑；3.至少实习半年，每周工作4-5天；4.	熟悉sql，了解SAS或R等挖掘软件和常规的数据分析方法；5.	具备较强的沟通协调能力、报告撰写能力及业务分析能力；6.	学习能力及工作责任心强、具有团队协作精神、能适应较大工作压力；",硕士,计算机/互联网,职位诱惑：团队氛围好 成长空间大 表现优秀可转正,数据分析师实习生,4天／周,实习6个月,150-200／天,500-2000人,https://www.shixiseng.com/intern/inn_fgt0mysfwaff
成都,成都,盼达用车,职位描述：岗位职责：1、负责收集整理系统平台数据以及业务数据，形成经营性分析报表；2、负责需求调研、商业分析以及数据挖掘；3、通过对用户的行为进行分析了解用户的需求，并提出解决方法；4、根据用户体验发现的问题，整合报告，与产品开发部门协调解决；5、对运营车辆进行监控并收集异常信息。任职要求：1、数学、计算机等相关专业大三大四在校生；2、有较强的需求分析能力、逻辑推断能力、沟通能力；、宏观把控能力3、要求掌握较深的计算机应用知识；4、能用行业相关应用软件进行各种数据分析和综合数据处理，并能形成数据分析报告；5、有数据分析工作经验者优先，有完整的调研-产品设计-跟进研发-推动上线-迭代产品的产品工作经历者优先。,本科,"能源,计算机/互联网",职位诱惑：福利完善、提供转正、团队给力、新,数据分析师,5天／周,实习15个月,100-150／天,50-150人,https://www.shixiseng.com/intern/inn_pwljsdqjbtil
广州,广州,时代大数据,职位描述：岗位职责：（1）收集客户分析需求，转化需求为可执行的分析方案；（2）基于分析方案，进行数据收集、挖掘建模、模型优化；（3）撰写分析报告；（4）跟进模型效果评估与优化；（5）其他数据分析挖掘技术性工作。岗位要求：（1）能快速理解客户需求，将实际需求转化为建模分析需求；（2）对数据挖掘的基本算法有一定了解和应用经验；（3）熟练使用SAS、JMP、SPSS、R等其中任一挖掘分析软件；（4）专业背景是应用数学或者统计学等相关专业。,硕士,计算机/互联网,职位诱惑：职业大牛带领，良好工作氛围,数据分析/数据挖掘,5天／周,实习10个月,150-300／天,150-500人,https://www.shixiseng.com/intern/inn_ehyu8nrkq3dq
北京,北京,易车互联,"职位描述：岗位职责：1.了解渠道广告投放业务，能搭建完整的日常指标监控体系，对影响业务环节的关键数据进行解读和分析，完善现有的模型和报表2.验证BI平台数据的准确性和及时性，对多来源数据进行交叉验证，发现数据异常，及时反馈给数据接收方，保障数据源的质量3.与业务、产品、技术多方沟通，能提炼业务需求，转化为数据模型和产品需求,推动数据产品落地实施任职要求：1.本科或以上学历，计算机、统计学、数学相关专业；2.实习期能够保证3个月以上，每周至少4天3.熟练掌握SQL语言，能运用Hive数据库进行多维度查询；精通Excel函数，包括但不限于vlookup,sumif,sumproduct,index,match等函数；了解BI平台基本原理和构造4.对数据驱动业务有深入理解，逻辑分析能力强，善于独立思考，具备良好的数据敏感度和沟通能力",本科,计算机/互联网,职位诱惑：中国汽车互联网平台的领军企业,数据分析实习生,4天／周,实习3个月,100-120／天,2000人以上,https://www.shixiseng.com/intern/inn_fu3kboiyorrj
北京,北京,北京交通发展研究院,职位描述：协助开展部门项目研究，辅助项目负责人开展移动源大数据分析与挖掘，相关的指标计算和数据库处理；协助开展移动源排放相关调研、测试、调查及排放数据分析，开展项目研究并辅助进行报告撰写等工作，要求：1.交通规划、交通工程、交通排放研究等相关专业；2.熟悉交通行业、机动车排放相关数据，有较强数据挖掘分析处理能力，大数据分析挖掘经验者优先，熟悉使用至少一门数据库分析软件者优先；3.具有较强的英语听说读写能力，有较强的分析问题和报告撰写能力，OFFICE办公软件熟练，有科研项目研究经验者优先；4.踏实能干，责任心强，有良好的敬业精神和团队精神；能够独立承担工作任务的能力；5.保证实习三个月以上者优先。工作内容包括：1.交通行业节能减排相关国内外文献整理与收集2.交通行业相关政策研究、策略研究与资料梳理3.交通行业交通大数据与节能减排数据分析与对策研究4.交通节能减排措施与解决方案研究5.相关调研与实地踏勘，报告撰写，其他辅助工作。,本科,环保,职位诱惑：与众多优质企业单位沟通学习，实习优异优先推荐入职。,交通数据分析与策略研究岗实习生,4天／周,实习7个月,75-100／天,50-150人,https://www.shixiseng.com/intern/inn_z3djlo5esobn
上海,上海,一条视频,职位描述：工作内容：-帮助进行内容数据的采集、录入和处理-维护日常报表，支持临时性数据需求与分析-协助完成较重要的分析项目-帮助落地内部沟通文档要求：-具备基本的数据处理能力，熟练使用excel，会写SQL-良好的沟通交流和理解能力-至少能做半年及以上-每周工作时间不少于三天-数学、统计或计算机专业背景更佳PS：公司目前办公地址为巨鹿路417号，2018年元旦后会搬到漕河泾开发区附近（9/12号线均可到达）。,不限,计算机/互联网,职位诱惑：学习成长机会 公司氛围好,数据分析实习生,3天／周,实习6个月,100-101／天,150-500人,https://www.shixiseng.com/intern/inn_wp3uixrvdpb0
武汉,武汉,摩拜单车,职位描述：这样的你：1、本科及以上学历，专业不限2、性格活波又不失沉稳，富于创造，敢于挑战3、能够玩转各种办公软件，对数据敏感，善于分析4、优秀的沟通表达和团队合作能力，能够适应快节奏的工作，热爱骑行来了以后：1、通过数据收集和整理，协助运营主管做好每周排班；2、帮助摩拜单车成为一种新的出行方式，在数据与工具的支持下，高效创新的完成数据分析工作，将数据整理分析汇集成表；3、负责参与各类项目支持工作,本科,计算机/互联网,职位诱惑：超好工作氛围；超棒团建；超nice上司,数据分析实习生,4天／周,实习5个月,100-120／天,500-2000人,https://www.shixiseng.com/intern/inn_kgy3raswth8u
北京,北京,优必爱,职位描述：岗位职责：1、理解车联网相关业务及数据应用需求，做“互联网+车联网”的跨界数据达人。2、针对车联网项目进行专项深度分析、模型构建，支持产品开发与决策。3、根据公司的实际业务要求，完成较深入的专项数据分析并形成分析报告。任职要求：1、统计、计算机、数学等相关专业，能连续至少2-3个月的实习期。2、熟悉统计学机器学习基本算法，能熟练运用Python、SQL、R等主流数据分析工具者优先。3、充满主动性，对未知和困难充满强烈的挑战欲望，良好的分析能力、沟通技巧。??。,硕士,计算机/互联网,职位诱惑：公司前景好,大数据分析实习生,5天／周,实习3个月,100-200／天,15-50人,https://www.shixiseng.com/intern/inn_1vgaf6ui7opc
北京,北京,优必爱,"职位描述：岗位职责：数据分析，数据建模，大数据解决方案软件架构设计，需求分析与设计；岗位要求：1、本科及以上学历在校学生，数学、计算机、信息化、统计等相关专业；2、具备相关领域的研究背景和研究能力，能够胜任数据分析建模或数据挖掘的相关工作。熟练使用统计分析软件，或了解大数据分析工具、架构（如Python,Spark）；3、具备独立的工作能力和团队协作精神，能够独立完成分配的工作任务，也具备与团队其他成员合作完成项目的能力；4、个人学习能力强，善与人沟通。",硕士,计算机/互联网,职位诱惑：职位前景好,数据分析师,3天／周,实习3个月,100-200／天,15-50人,https://www.shixiseng.com/intern/inn_kkzynihdomzq
广州,广州,三七互娱,职位描述：职位描述：1、日常监控数据，实时发现并解决广告投放中出现的问题；2、负责部门广告数据整理与分析，能够基于数据分析得到有价值的信息，为广告投放决策供数据支持；3、优化并不断改进市场广告流程以及报表系统；4、收集并拓展游戏行业内数据报告；5、完成部门日常的其他数据支撑工作。任职要求：1、本科以上学历，英文读写熟练，数据分析专业相关（理学、统计学、数据挖掘专业优先）；2、具有优秀的学习能力，条理清晰，有良好的表达能力及沟通能力，有较强的组织语言文字功底，数据分析和逻辑能力；3、做事认真细心，有上进心，有责任感，能承受工作压力，适应游戏公司的快节奏；4、态度积极，有较好的沟通能力，游戏产品页游、手游有一定理解了解；5、精通Excel各项分析与统计，掌握一些基础数据分析工具；6、具有相关游戏分析相关工作经验优先。,本科,互联网,职位诱惑：工作环境优美，福利待遇优，公司平台大,数据分析实习生（广告分析方向）,4天／周,实习8个月,100-150／天,2000人以上,https://www.shixiseng.com/intern/inn_tm1xu5bli1ve
北京,北京,爱智康,职位描述：数据分析实习生岗位职责：1.利用数据分析软件，对公司产品数据（日活、埋点数据等）进行合理分析。2.与其他部门对接数据需求，可以对数据需求进行相应规划。3.实时监控数据状况，从数据出发给运营客服部门提供合理的优化建议，并且可以基于相关数据书写分析报告。4.会简单SQL语句进行数据查询。岗位要求：1.熟练掌握Excel，会函数运算以及在Excel中设计数据图表。2.熟练掌握PowerPoint，懂得如何布局，将数据更好的展示。3.对数据具有一定敏感度，逻辑思维能力强，会对数据分析结果进行相应的描述性分析。4.勤奋好学，积极向上，具有良好的沟通理解能力。5.数学、统计学相关专业优先，有转正机会,本科,教育,职位诱惑：节日福利、周末双休、有转正机会、上市公司,数据分析实习生,4天／周,实习3个月,120-150／天,2000人以上,https://www.shixiseng.com/intern/inn_azlqeqghoaf1
北京,北京,融360,职位描述：该职位接受暑期实习&长期实习。岗位职责：1、协助分析师完成市场业务相关数据支持；2、协助数据分析师，监控业务效率，发现业务风险点，并推动解决；3、协助分析师跟进数据策略实施进度，跟踪效率；4、提升数据使用效率，完善数据报表及预警工具。任职要求：1、本科以上教育背景，计算机、数学、金融、等理工科专业。2、逻辑清晰，思维缜密，善于数据分析，了解sql。3、了解互联网业务；4、很强的沟通能力、团队合作能力、抗压能力，积极进取；??,本科,"互联网,金融/保险",职位诱惑：福利待遇好，十点上班，哥哥姐姐认真负责，能学到新东西~,2019暑期实习-数据分析助理,5天／周,实习3个月,150-180／天,500-2000人,https://www.shixiseng.com/intern/inn_k9zhkr2igerx
