address,city,compname,contents,education,industry,jobgood,jobname,jobway,month,salary,size,url
上海,上海,交复医学,职位描述：在这个岗位上，您将有机会：1.广泛接触不同的生物芯片测序、芯片分析的数据和软件，参与科研服务项目；2.掌握不同的数据分析技术，加入交复科研学术团队，提供专业科研技术服务；3.共同完成科研服务项目，充分掌握当前最前端的医学科研信息。一、工作内容：1.在指导老师的安排下，进行各公共专业生物数据库（如GEO数据库）的信息检索、整理、挖掘等；2.分析基因芯片等，整理生物信息分析报告；3.根据项目情况，灵活根据分析需求编写或维护分析流程等。二、工作要求：1.理科相关专业大三及以上本科生及研究生，985、211及医药类高校优先；2.英语阅读能力强，通过六级，或者雅思、托福、GRE，能流利阅读英文相关文献或数据库检索能力，会优先考虑；简单了解Perl，R等编程语言等；3.每周至少实习3天及以上（含周六日），实习至少3个月。三、薪酬待遇：1.实习薪资：150-300元/天（根据考核评级）；2.对于异地实习生，月出勤满20天及以上，公司将给予住房补贴；3.实习可留用（月薪税后7k起）；4.实习期间，公司可提供实习证明，推荐信；转正的同学，提前签订三方协议；5.多地点办公，本岗位可根据实际情况，就近安排面试和工作地点。四、工作安排：1.工作地点：上海市闵行区剑川路951号交大零号湾1号楼711室上海市杨浦区密云路1018号复旦科技园10号楼乙东301室2.工作时间：每周周一至周日3.上班时间：08:30-17:304.午休时间：12:00-13:30五、联系我们：公司名称：上海交复生物医药科技有限公司上海交通大学办公室：上海市闵行区剑川路951号交大零号湾1号楼711室上海复旦大学办公室：上海市杨浦区密云路1018号复旦科技园10号楼乙东301室四川成都高新办公室：成都市高新区蜀锦路88号楚峰国际中心4607室,本科,生物/医疗,职位诱惑：高薪资，可转正，校园平台，复旦交大学生平台，免费培训,生物芯片数据分析实习生,3天／周,实习4个月,150-300／天,50-150人,https://www.shixiseng.com/intern/inn_wlkfogqbm9ch
温州,温州,中广核俊尔,职位描述：1、负责公司成品的检测和鉴定工作；2、负责客户公司质量问题的追踪反馈；3、负责检测数据的分析建模。要求：化学、化工类专业应届本科毕业生；掌握一种或几种检测工具；良好的沟通协调能力。,本科,化学化工,职位诱惑：上市公司，发展空间大，制度规范，工作自由，提供住宿,数据分析工程师,6天／周,实习4个月,130-160／天,500-2000人,https://www.shixiseng.com/intern/inn_dqg8wrrfxjfg
上海,上海,随办app,职位描述：职位描述:1、根据全球某著名高端餐饮品牌APP的市场定位，提供创意文案和策划。最好是对饮食有热情的吃货一枚；2、负责著名移动办公平台--随办的功能描述、价值展现、活动策划；3、根据ASO/SEO的运营策略，提供功能文案和创意内容文案；4、结合用户的工作场景和社会热点，撰写短文章、情感短句，情景小视频的脚本和内容；职位要求：1、19届毕业生优先，市场营销、广告、传媒或汉语言文学专业为佳；2、有撰写新媒体文章经验，内容的提炼能力强，融会贯通能力强；3、理解toB的管理软件功能，喜欢研究各种App；4、擅长PS和视频制作软件者优先；5、热爱互联网，熟悉新媒体，对内容营销、热点趋势有敏锐的察觉力；6、学习和研究能力强，表达和沟通顺畅。你将得到：转正留用机会实习证明顶尖IT/移动互联网的跨界公司的工作氛围和人际关系，轻松愉快的度过每一天；开放办公环境，再牛的大佬都就在你周围；迅速提升的学习机会和职业发展路径；,本科,计算机/互联网,职位诱惑：优秀团队，良好的办公环境，快速成长和发展的机会,网络运营&数据分析&EDM,3天／周,实习15个月,100-200／天,50-150人,https://www.shixiseng.com/intern/inn_eblvdfvm3e4h
北京,北京,北森云计算,职位描述：岗位职责：1、基于公司的业务和行业信息进行数学建模，搭建数据模型，进行深度的数据分析和数据挖掘；2、完成需求分析、样本抽样、模型构建、指标定义以及相关文档编写；3、参与数据平台等系统的规划与设计，将数据分析的结果实现产品化；任职资格：1、精通常见分类/聚类/回归/排序等数学模型；2、985/211学校2019年毕业的研究生，计算机、统计学等相关专业优先；3、可以熟练使用主流的数据分析工具如SPSS、SAS等，掌握数据挖掘工具R/python/matlab等；4、性格开朗，能够自我驱动，有激情，有梦想，爱创新，追求卓越;,硕士,计算机/互联网,职位诱惑：弹性工作制，下午茶咖啡不限量供应，与技术大牛共事,数据分析师实习,5天／周,实习6个月,160-250／天,500-2000人,https://www.shixiseng.com/intern/inn_hbfrdnzruafd
北京,北京,北森云计算,职位描述：岗位职责：1、基于公司的业务和行业信息进行数学建模，搭建数据模型，进行深度的数据分析和数据挖掘；2、完成需求分析、样本抽样、模型构建、指标定义以及相关文档编写；3、参与数据平台等系统的规划与设计，将数据分析的结果实现产品化；任职资格：1、精通常见分类/聚类/回归/排序等数学模型；2、985/211学校2018/2019年毕业的研究生，计算机、统计学等相关专业优先；3、可以熟练使用主流的数据分析工具如SPSS、SAS等，掌握数据挖掘工具R/python/matlab等；4、性格开朗，能够自我驱动，有激情，有梦想，爱创新，追求卓越;,硕士,计算机/互联网,职位诱惑：行业NO.1 弹性工作 优厚福利,数据分析师（实习）,5天／周,实习6个月,150-250／天,500-2000人,https://www.shixiseng.com/intern/inn_pxva18hal3np
北京,北京,神州数码,"职位描述：1.参与数据分析和建模课题研究2.海量数据的数据挖掘3.根据特征工程进行特征选择4.模型训练及模型检验评价5.实现预测分析、用户画像、推荐系统等6.政务业务模型建立，提出优化算法并用高级语言实现7、相关资料搜集8、其它交办事宜 
岗位要求: 1.扎实的统计基础和数学建模能力；2.熟悉预测类数据建模过程，有参与数据挖掘建模项目经验；3.熟悉聚类、分类、回归等机器学习算法；4.熟悉推荐算法，分类算法、关键词推荐等；5.熟悉MatLab、SPSS、Phthon、R语言（至少一种）并有实践经验6.良好的沟通能力和团队协作精神",硕士,互联网,职位诱惑：知名企业 内部推荐机会 年轻团队 学习提升,数据分析实习助理实习生,5天／周,实习3个月,80-150／天,2000人以上,https://www.shixiseng.com/intern/inn_kkdv23erkom1
北京,北京,神州医疗,职位描述：该职位接受暑期实习。职位描述：1、卫生、计生和社保等政策研究，进行相关的数据分析和建模工作。2、根据政策方向和客户需求，提供卫生信息化解决方案；3、疾病诊断分组、医疗资源和费用的合理性分析、辅助卫生决策；4、该实习岗位办公地点为国家人口发展中心，位于魏公村。职位要求：1、全日制本科三年级或硕士研究生，公共卫生、医学信息学、统计学、应用数学等相关专业；2、具有良好的数学基础以及数据分析和建模经验，具有医疗、社保数据分析或大数据的相关行业实习经验优先。3、具有良好的语言组织和沟通能力。4、具有独立的工作能力和团队协作精神。,本科,计算机/互联网,职位诱惑：国家项目，大公司，成熟团队,数据分析师,4天／周,实习3个月,100-150／天,500-2000人,https://www.shixiseng.com/intern/inn_8hr4e4u7l46z
惠州,惠州,58安居客,职位描述：岗位职责：1、统计、分析本网站及本城市销售数据、销售行为工作量数据、市场客户会员数据等，监控业绩进度及销售行为管控，为城市经理提供数据依据；2、辅助城市管理者整体运营，辅助制定城市运营策略、方案和计划并组织执行；3、贯彻实施公司运营管理制度和流程，制定和完善各项业务流程，保障好的用户体验和效率的提升；4、客户回访机制执行，聚类城市发展问题点，是主管、销售沟通解决业务层面问题点；5、根据城市发展现状，找出问题点并提出解决方案，制定综合解决方案，与城市管理者沟通方案并做落地执行、结果反馈，保障城市既定目标的达成；任职要求1、大专及以上学历；2、有互联网金融销售助理、销售管理、数据运营、产品运营等相关经验优先；3、数据处理能力较好，熟练应用各项办公软件，；4、性格乐观开朗，具有良好的沟通表达能力，有较好的团队合作精神，有独立分析、思考和解决问题的能力。,大专,计算机/互联网,职位诱惑：上市集团公司  五险一金  高温采暖补贴  绩效奖金,数据运营分析专员(应届毕业生),5天／周,实习3个月,200-275／天,2000人以上,https://www.shixiseng.com/intern/inn_ddzxuiljleba
苏州,上海,安硕信息,职位描述：1.本科及以上学历，金融、经济、统计、数学、信息系统等相关专业；2.有良好的业务分析或数据分析能力，熟悉金融业务知识，或具有统计、计算机技术和数据挖掘知识背景；3.熟练掌握OFFICE办公软件，有较好的文案功底，PPT制作能力；4.具有良好的沟通技能和团队协作能力；5.抗压能力强，能接受出差工作。,本科,计算机/互联网,职位诱惑：上市公司 发展前景好,咨询顾问/需求分析（金融业务/数据方向）,5天／周,实习3个月,120-150／天,2000人以上,https://www.shixiseng.com/intern/inn_naumhs0sqdc3
北京,北京,易车互联,职位描述：工作内容：1、根据业务场景，构建渠道质量和效率的监控指标体系和模型，能够及时、准确、完整地反馈业务运作情况。2、与运营对接，建立专项的分析报告，为运营优化决策和产品方向提供数据分析支持。3、能够持续地动态地挖掘日常业务数据点，发现业务的风险和机会点。4、与大数据对接，确认各环节评估参数，搭建各项指标，完善数据监控体系；任职资格：1计算机、数学等相关专业优先；2掌握常规的统计方法，熟悉sql，熟练使用excel进行数据分析；3对商业和业务逻辑敏感，具备良好的逻辑分析能力和系统性思维能力，良好的跨团队的沟通能力；4数字敏感度高，具备较强的分析总结能力，具备良好的数据呈现能力；,本科,计算机/互联网,职位诱惑：中国汽车互联网平台的领军企业,产品运营数据分析实习生,4天／周,实习8个月,100-120／天,2000人以上,https://www.shixiseng.com/intern/inn_hyeyumsflqdz
上海,上海,时趣互动,职位描述：数据分析师实习生/数据工程师实习生工作职责：1、在mentor的指导下进行业务专题的数据处理与分析工作；2、协助制作日常业务运营报表模板的设计、分析咨询报告的制作等3、支持客户业务运营需求，并参与知名快消品牌的用户群体画像标签体系的设计配置工作；4、一周至少可工作4天，能工作5天者优先，一周内到岗。任职资格：1、本科及以上学历，数学、计算机、统计学等理工科专业优先，有相关工具使用经验申的其他专业同学亦可申请；2、熟练使用Excel，掌握常用公式/常见图表/数据透视表等；3、具有使用Python、R、SQL、VBA等（至少熟悉一种）进行数据处理的经验；4、有过数据分析、数据建模等项目相关实习经验，快消、零售、互联网相关行业经验preferred；5、做事细致、思维缜密、善于沟通、具有团队协作意识；,本科,广告,职位诱惑：周末双休 弹性工作 领导nice 福利多多,数据分析实习生（19届）,4天／周,实习8个月,120-170／天,500-2000人,https://www.shixiseng.com/intern/inn_bemjrujl4onv
北京,北京,Geekplus,职位描述：岗位职责：进行机器人数据和复杂问题分析，数据分析算法研究；任职要求：1.机电、计算机、自动化、软件等专业优先；2.工作经验不限，需具备快速学习能力，有相关工作经验优先；3.熟练应用excel，ppt等办公类软件，有数据分析经验优先；4.具备良好的责任心、上进心、执行力以及良好的沟通能力和团队合作精神；5.突出的分析与解决问题的能力；6.对机器人有浓厚兴趣优先。,不限,计算机/互联网,职位诱惑：弹性工作,机器人研发部-数据分析工程师,3天／周,实习3个月,200-300／天,150-500人,https://www.shixiseng.com/intern/inn_cxvqcexdubq2
北京,北京,广联达,职位描述：任职要求：知识/经验：具有数理统计，经济学，数据库原理以及相关知识；能熟练使用EXCEL、SQL、PLSQL、ORACLE等办公软件和数据库软件。工作能力：严谨的逻辑思维能力、学习能力、言语表达能力敏锐的数据观察能力、团队沟通能力工作态度：积极主动、工作认真、工作严谨岗位职责：1、根据数据分析方案进行数据分析，在既定时间内提交给市场研究人员；2、能进行较高级的数据统计分析；3、负责项目的需求调研、数据分析、商业分析和数据挖掘模型等，通过对用户的行为进行分析了解用户的需求；4、参与业务部门临时数据分析需求的调研、分析及实现；5、参与数据挖掘模型的构建、维护、部署和评估；,不限,互联网,职位诱惑：工作环境好，学习机会多，免费班车，免费晚餐,数据分析员,4天／周,实习3个月,120-150／天,2000人以上,https://www.shixiseng.com/intern/inn_80uijm79cwpm
北京,北京,好专业,"职位描述：岗位职责：1.根据要求及教育测量标准进行数据整理、统计与分析；2.挖掘潜在市场需求及技术趋势，完成教育测量产品规划工作。任职要求：1.211院校本科或研究生在读，应用数学、统计学、计算机、教育测量、教育技术及相关专业；2.熟练使用数据分析工具（Excel,SAS,SPSS）／数据分析语言（R,Python,Matlab）／数据展示工具（Powerpoint,Keynote,Tableau），优先；3.具有创新教育测量产品服务意识，善于调研国内外先进理念与思路；4.善于时间管理，责任心强，良好的团队协作精神。我们提供极具挑战性的工作目标；扁平化组织，有创意的团队伙伴；开放、舒适的工作氛围，有零食、饮料和空调的工作环境；高于行业一般水平的各方面回报；实习的小朋友们，相看两爱，毫不犹豫转正留用。公司介绍好专业升学规划研究院，全国唯一新中考新高考“一站式”辅助方案提供者。致力于使用信息化技术、现代化教育工具和理念，服务教育系统和中学，实施新中考、新高考政策。公司规模：50人公司地址：北京三元桥",本科,计算机/互联网,职位诱惑：创意的团队伙伴，转正机会，零食、饮料，boss超nice,教育数据测量与分析实习生,5天／周,实习3个月,120-200／天,50-150人,https://www.shixiseng.com/intern/inn_7sg3murjjsjq
上海,上海,亿腾医药,职位描述：工作职责：1、协助主管统计分析各类销售数据，进行数据清洗；2、协助主管整理审核销量申诉材料，处理销量申诉；3、整理部门的各类文档、资料，统计并录入系统；4、上级交办的其他工作。岗位要求：1、大专及以上在校学生，数学、统计学、财务类、经济类相关专业优先；2、熟练使用Excel，掌握SPSS、SAS等统计软件更佳；3、一周可在公司实习工作至少3天。,大专,医药,职位诱惑：留用机会大、地理位置佳、团队氛围轻松、免费饮料吧,数据分析实习生,3天／周,实习15个月,100-120／天,500-2000人,https://www.shixiseng.com/intern/inn_rv9ujvql7cqo
上海,上海,欧尚,职位描述：工作描述:・对已有的常规数据分析报告进行核查；・协助会员团队、微信团队的工作，对超市顾客的营销方案提供有效、合理、精准的数据支持；・协助公司其他的部门、团队，给予必要的支持；・当数据库中的数据不干净时，进行必要的乏味的清洗工作，数据分析当中80%的时间都用在数据清洗上；・完成上级主管交待的任务；・数据库里的数据千千万万，超市的机器是不会说谎的，从海量数据的常规数据、异常数据当中，挖掘出有商业价值、一般人无法洞悉的结论；・挖掘算法成百上千，统计学的理论与商业的实践如何真正结合落地。只要能产出营业额的算法或者指标，我们不需要“愚蠢”的卡方检验，我们也不在乎模型的过拟合，毕竟我们不需要把火箭送上太空再安全回收；・我们团队隶属于创新部，我们非常喜欢那些看似愚蠢并且不切实际的想法，你不会因为这样的想法被我们按在火刑柱上。职位要求:・不爱上课、空闲时间多的佳；・统计学（会加减乘除）、信息系统（会写代码）专业相关的同学佳；・一周至少3天；・SQL熟练，R或者Python加分（代码只是工具，脑子才是王道）；・自我驱动能力强（工作上就是要没事找事）；・工作热情，性格开朗（沟通能力是很重要的）；・有英语的基础（如果口语不好，能用肢体语言传递信息也是可以的）。,不限,其它,职位诱惑：福利待遇好，发展前景好。,创新部数据分析实习生,3天／周,实习9个月,150-160／天,2000人以上,https://www.shixiseng.com/intern/inn_v7afxj4u9vzn
上海,上海,Admaster,职位描述：实习可转正，全职招聘，可接受应届生，月薪6-8K（看个人background及面试情况）13薪+bonus。倾向于2018毕业的应届毕业生，希望大家把简历中的实习经历或者项目经历写完整些，在筛选简历时会非常看重。岗位职责：负责广告项目监测数据的收集、整理、筛选，准时准确地完成报告根据监测数据，及时发现问题并提出合理性解决方案及建议在leader的指导下，完成季度、年度等大型报告维护现有客户关系，定期为既有客户进行网络广告最新行业动态的培训客户包含可口可乐、欧莱雅、百威等等快消行业、捷豹路虎等汽车行业以及其他行业。任职要求：本科及以上学历，广告，市场营销、心理学、统计等相关专业优先较强的沟通与表达能力工作热情，有服务精神良好的服务意识和团队合作精神学习能力强，有责任心，对数字敏感优秀的英文听说读写能力，能熟练使用PPT和EXCEL,本科,"文化传媒,计算机/互联网",职位诱惑：互联网行业、发展潜力大、数据分析、免费咖啡牛奶茶水果、包午餐,数据分析师（广告数据监测）,5天／周,实习4个月,100-120／天,500-2000人,https://www.shixiseng.com/intern/inn_exuwwwxjabrf
上海,上海,Admaster,职位描述：实习可转正，全职招聘，倾向于接受应届毕业生，入职时间ASAP基础月薪6-8K+bonus，13薪。岗位职责：负责广告项目监测数据的收集、整理、筛选，准时准确地完成报告根据监测数据，及时发现问题并提出合理性解决方案及建议在leader的指导下，完成季度、年度等大型报告维护现有客户关系，定期为既有客户进行网络广告最新行业动态的培训任职要求：本科及以上学历，广告，市场营销、心理学、统计等相关专业优先较强的沟通与表达能力工作热情，有服务精神良好的服务意识和团队合作精神学习能力强，有责任心，对数字敏感优秀的英文听说读写能力，能熟练使用PPT和EXCEL,本科,"文化传媒,计算机/互联网",职位诱惑：免费咖啡牛奶茶、餐补、互联网行业、发展前景大,数据分析师（广告监测方向）,5天／周,实习5个月,100-120／天,500-2000人,https://www.shixiseng.com/intern/inn_swyu4zmf06o7
上海,上海,七牛云,职位描述：工作职责：1、成为市场、销售、财务、产品等其一业务方的数据合作伙伴，协同推动公司业务增长；2、致力于通过数据分析、数据运营帮助业务伙伴一起协同实现其业务需求，解决业务痛点，共同实现商业价值落地；3、帮助业务方构建业务商业价值实现的量化运营指标模型体系，并且建立数据报表可视化体系；4、针对业务场景下的用户生命周期，协助解决用户使用的痛点与问题异常点，让用户价值最大化、让用户转化更加流畅；5、监控异常数据现象，建立有效的数据预警监控模型，及时与业务方一起发现问题、分析问题、解决问题；6，及时通过数据与一线业务经验合作发现业务异常问题，进行数据分析建模，撰写分析报告，对业务部门提供分享数据分析成果，与业务部门进行及时交流沟通；协同业务方推动公司数据价值最大化帮助、协同构建公司统一数据视图。职责要求：1、2018届应届生；2、互联网、企业服务等相关业务数据分析、数据挖掘经验；3、必须具备很好的合作精神，以及帮助他人的积极心态，协同共享的心态；4、有很好的业务敏感度及商业感觉，对数据如何帮助业务增长有很好的理解与领悟；5、具备良好的沟通能力和表达能力，能够独立开展业务调研、数据分析、报告编写工作；6、熟悉数据分析与数据挖掘理论；有海量数据分析经验，熟练使用SAS、SPSS、R、SQL等工具进行数据分析；7、有企业服务、云计算行业数据分析、数据挖掘经验者优先。,本科,计算机/互联网,职位诱惑：六险一金 免费健身 绩效奖金 弹性工作,数据分析师,4天／周,实习7个月,200-300／天,500-2000人,https://www.shixiseng.com/intern/inn_fz9zglcrwg80
北京,济南,埃森哲,职位描述：工作内容：1、Hadoop数据ETL处理2、运用python进行数据分析3、后期可能涉及数据挖掘建模。要求：熟悉结构化查询语言，Hive优先；能熟练python进行数据清洗和建模，具有一定的统计学基础；保证一周5天的工作时间，6月中旬尽快到岗；985在校生优先。,不限,企业服务,职位诱惑：大数据挖掘项目的学习和实践机会,大数据分析实习生,5天／周,实习2个月,145-150／天,2000人以上,https://www.shixiseng.com/intern/inn_0a7tdxpmu2qk
杭州,杭州,abc360,职位描述：工作职责：1、根据公司战略需求，整理数据并设计纬度数据报表，指导相关部门安排进度并监督；2、根据产品数据分析，对产品的用户分层分析，产品定位，产品各个业务内容的漏斗分析，基于数据内容为产品提供决策支撑以及优化建议；3、监控运营部门KPI相关数据，出具部门的数量、活跃度、业绩等数据结果报告；4、规划数据分析应用项目，开展并推动项目应用和发展。任职资格：1、硕士以上学历，统计学、数学相关专业优先；2、熟练使用数据分析工具，制作分析报告；3、对数据敏感，细心耐心，有很强逻辑能力；4、有较强的执行力、推动力和团队协作能力。,硕士,计算机/互联网,职位诱惑：行业大拿 发展前景 办公环境 工作氛围,BI数据分析实习生,5天／周,实习4个月,120-130／天,500-2000人,https://www.shixiseng.com/intern/inn_krnvwapu6t0d
