address,city,compname,contents,education,industry,jobgood,jobname,jobway,month,salary,size,url
北京,北京,尼尔森,职位描述：职位描述：工作内容：1、汽车行业案头研究；2、翻译中英文报告；3、协助项目进行数据处理与分析，会数据透视表、vlookup函数等优先；4、协助完成问卷编译、项目调研和报告撰写等工作；5、协助处理项目实施过程中各部门工作。入职要求：1、实习期间需保持学生身份（大四毕业即将读研或者出国也可）；2.、逻辑清晰，认真细致，学习能力和责任感强；3、较强的英语听说读写能力；4、熟练操作Excel和PPT；5、可立即面试，六月初可入职，可保证一周至少四天，实习期三个月及以上，时间不能满足者勿投。实习收获及体验：1、作为全球市场咨询Top1企业，你可以在这里学习世界五百强企业在市场咨询领域的思维模式和大量数据的分析能力，对立志于从事市场分析、咨询等行业的同学是个很好的锻炼机会；2、作为先端美国公司，操作系统及邮件系统均为英文，可感受外企氛围，锻炼英语能力；3、公司氛围包容开放，组里的同事都很nice，不懂的会耐心教给你；4、每天十点上班，适合起床困难户；5、实习工资100RMB/天，实习地点北京市王府井大街新东安T1写字楼（apm楼上），可提供实习证明。,不限,市场调查,职位诱惑：市场咨询的龙头企业；世界500强；全英工作环境,Auto汽车组数据分析实习生,5天／周,实习3个月,99-101／天,500-2000人,https://www.shixiseng.com/intern/inn_6kztcwgicun2
北京,北京,映客直播,职位描述：职位职责：1、梳理业务逻辑，对业务数据进行分析和监控，数据驱动支持业务决策；2、支持业务方及团队内部数据需求；3、数据报表展现及数据产品设计。职位要求：1、要求本科大二/大三，研一/研二在读，计算机、统计、数学相关专业优先;2、能够实习3个月以上，每周保证4天以上；3、能熟练使用SQL，熟悉数据仓库&amp;Hive，了解数据仓库建模、数据可视化、数据分析与建模；4、抗压能力强，沟通协调推动能力强，积极主动，肯思考，具有独当一面的能力；5、加分项：熟练使用Python/R，熟悉常用的数据统计和分析方法。,本科,计算机/互联网,职位诱惑：免费健身房    福利待遇好   技术大牛指导,数据分析实习生,4天／周,实习5个月,130-160／天,500-2000人,https://www.shixiseng.com/intern/inn_cswfhl8u14rx
广州,上海,Admaster,职位描述：实习可转正，全职招聘，倾向于接受2018应届毕业生，入职时间ASAP基础月薪+bonus，13薪。岗位职责：负责广告项目监测数据的收集、整理、筛选，准时准确地完成报告根据监测数据，及时发现问题并提出合理性解决方案及建议在leader的指导下，完成季度、年度等大型报告维护现有客户关系，定期为既有客户进行网络广告最新行业动态的培训任职要求：本科及以上学历，广告，市场营销、心理学、统计等相关专业优先较强的沟通与表达能力工作热情，有服务精神良好的服务意识和团队合作精神学习能力强，有责任心，对数字敏感优秀的英文听说读写能力，能熟练使用PPT和EXCEL,本科,"文化传媒,计算机/互联网",职位诱惑：免费咖啡牛奶茶、餐补、互联网行业、发展前景大,数据分析（social/tack）,5天／周,实习3个月,100-120／天,500-2000人,https://www.shixiseng.com/intern/inn_epeuaayyptis
深圳,深圳,晨星资讯,"职位描述：该职位接受暑期实习。Responsibilities:lUseMorningstardatacollectionsystemtotimely,accuratelyandcompletelycollectequityfundamentalsdatainBalanceSheet,CashFlowStatement,IncomeStatement,andfootnotesforNorthAmericanandAsianmarketcompanies,andbuildandmaintainglobalmainstockmarkets’equitydatabase.lActivelydiscoverandraiseissuesinwork(includingsystem,process,andespeciallycollectionmethodology)andproposeenhancementsuggestiontofurtherimprovesystemfunctionality,processefficiencyanddataquality.lCloselyworkwithqualityassuranceandtechnicaldepartmenttoresolveclients’dataissuestimelyandeffectivelylUnderstandcurrentprocessandqualitystatusthroughrelatedindicators,andcorporatewithtechnicalandprojectmanagementdepartmenttodriveimprovement.lParticipateinotherdataandprocessrelatedprojects,likeindustry/marketdatacollectionmethodologyresearch,marketexpansion,processcertification,newproductdevelopmentsupport,etc.l使用晨星的数据收集系统，按照标准的采集流程，及时、准确、完整地收集北美和亚太地区上市公司年报、季报里财务报表科目和附注数据，建立和维护全球主要金融市场的股票数据库。l与数据监测和技术等部门紧密协作，及时高效地解决客户提出的数据问题。l积极发现工作中的问题（包括系统，流程，采集方法论等），提出可行性改进方案，提高系统流程效率，提升数据质量。l通过分析相关指标了解流程和质量情况。并与技术、项目管理部门合作，持续改进。l参加其他数据和流程相关的项目，如行业、市场数据方法论研究，市场扩张，流程认证，新产品开发支持等。要求Qualifications:lBachelordegreeandabove,inareasofaccounting,financemanagement,finance,andeconomics.lNorequirementforworkexperience,freshgraduatesisqualifiedtoolProficientinEnglishinreadingandwriting,CET6andaboveispreferredlGoodEnglishfinancialstatementreadingandanalyticalskilllGoalorientatedandwithgoodcommitmentontask/projectdeliverylAnycertificates/candidateonCFA/CPAisaplusl本科及以上学历，专业为会计、财务管理、金融相关。l工作年限不限，可录用应届毕业生。l有非常良好的英文读写能力，至少要求六级以上。l良好的英文财报阅读、分析能力。l目标导向，按任务、项目要求高质量交付工作成果。l具有ACCA/CFA/CPA资格或者在考人员为佳。注：该岗位为正式岗位，可接受应届毕业生。",本科,金融/保险,职位诱惑：高大上工作环境，大平台，福利佳,Equity Data Analyst/ 股票数据分析员,5天／周,实习3个月,100-150／天,500-2000人,https://www.shixiseng.com/intern/inn_x0x4i9bfaq40
南京,南京,雷森科技,职位描述：工作时间：2018年9月1日起开始：①工作周期：三个月。每周要做20小时以上，从周一到周日，上午九点到下午六点，可以任选半天（上午九点到中午一点、中午二点到下午六点）。每月需要完成任务量。②单次时间不能低于四小时。③如果仅在周一到周五有时间，可在五天内来四个半天，每次四小时。④公司晚场时间（下午18点~下午21点），有兴趣可以登记晚场标注。有效时长：①每条语音长1~7秒，根据标注规则（需要添加F1、F2、F3、F4、F6、F7、F8、F9）标写相应文字内容或单词、标点符号，达到准确率95%的语句对应的秒数计时，累计出来的时间即为有效时长。②人工判断语音片段是否为有效语音，如有效则按规范标注，对于无效语音直接放弃。机位安排：①在公司指定的电脑上，每人给一个固定用户名进行登录，办公室电脑可以选择随意座位，听给出的音频，并把听到的内容用文字或单词打出来，并按照规定规范操作。②中文和英语的处理机位分开在二个房间。评优奖惩：公司每月根据标注时长选出前三名进行奖励，并同时对最后倒数三名进行统计，进行指导、劝诫、辞退。数据安全：任何人不可连接机器的USB接口和网口，不得复制数据，违反规定，解除合作关系，追究个人相关责任。公司地址：仙林元化路南大科学园创新创业学院四楼412室。①地铁2号线南大校区下转321路公交坐三站到南大科学园下，进门第三栋楼（创新创业学院）西面门厅坐电梯；②走南大仙林校区（天文楼位置）东北门到南大科学园。③从南大地铁站，共享单车骑行时间预计10分钟工资结算：①标注员工资以有效正确时长结算。质检员工资以复核时间计算。②工资月结，由南京雷森公司直接汇入个人银行卡（不限开户行），兼职工资月超800元需按国家税务规定缴纳个人所得税，税率20%，由公司代扣代缴,本科,计算机/互联网,职位诱惑：人工智能，机器学习，语音识别，英语发声，南京大学，交通方便,语音识别大数据集标注分析师,5天／周,实习4个月,150-300／天,少于15人,https://www.shixiseng.com/intern/inn_pcp8lk3yjvsa
北京,北京,资产360,职位描述：岗位职责：1.负责完成针对金融数据的统计分析、报表汇总等相关工作；2.负责完善数据分析标准体系与分析模型；3.辅助其它部门完成必要的数据统计信息；4.完成部门领导交予的其它工作。任职要求：1.本科（全日制统招）及以上学历，统计、信息技术、经济学等相关专业；2.踏实稳重，认真仔细，较强的沟通协调能力及分析能力；3.熟练运用excel，SQL语句等数据统计及相关分析软件。针对2019年应届生，可以实习六个月以上优先,本科,计算机/互联网,职位诱惑：优秀团队、可以转正,数据分析实习生,5天／周,实习6个月,100-200／天,150-500人,https://www.shixiseng.com/intern/inn_g0lw2aficylu
北京,上海,快钱公司,职位描述：岗位职责：-负责重点项目的日常运营工作，如：进度跟踪，信息核实，沟通协调等内容。-负责产品的日常运营工作。如：活跃度，区域分布，人群分布等内容。-负责根据工作计划和实际开展情况，提出合理化建议，提升团队工作效率。-负责跟进商户运营中存在的问题，反馈问题处理结果。岗位要求：-本科及以上学历(在读本科生或研究生)；-有较强的沟通协调、团队协作能力；-热爱互联网支付，有金融行业、互联网行业相关实习或项目经验者优先；-每周至少3天以上的实习时间,本科,"计算机/互联网,金融",职位诱惑：节日福利 午餐补助 有师傅带,数据分析实习生,3天／周,实习3个月,100-150／天,500-2000人,https://www.shixiseng.com/intern/inn_pjbwdseg4rd6
成都,北京,麦可思,"职位描述：岗位职责1.	负责公司调研项目的数据清理、数据分析，基于分析结果撰写分析报告/PPT；2.	根据客户对项目的需求或反馈信息，提出合理化解决方案；3.	参与项目分析方案、测量问题等方面的设计，从数据角度给出建议；4.	为公司业务部门提供数据需求支持。任职资格：1.统计学、应用数学、信息与计算科学、社会学、经济学等相关专业本科及以上学历；2.有相关实习或工作经验者优先；3.熟悉SAS/SPSS/R、Excel、PPT等常用工具，了解常用统计分析方法；4.注重细节，对数据有高度敏感性和洞察力；5.逻辑性强，具备快速学习和分析能力；6.具有良好的沟通能力和团队协作精神。",本科,教育/培训,职位诱惑：行业领军企业、新三板、,数据分析岗-成都-00408,5天／周,实习3个月,80-150／天,150-500人,https://www.shixiseng.com/intern/inn_8b8hlo74vwbl
广州,广州,广州棒谷,职位描述：【岗位职责】1.负责部门内运营数据采集、统计与分析工作，并能结合运营实际，提出改善意见和方案；2.针对特定业务问题进行分析并给出报告，如销售分析、客户分析、竞争对手分析等；3.为部门内提供数据支持，包括日常运营数据反馈、业务项目实施数据比对等；4.领导安排的其他工作。【岗位要求】1.本科以上学历，英语四级或以上，可接受应届毕业生；3.熟悉市场分析或数据分析的主要方法，熟练运用Excel等常用软件；4.对数据敏感，良好的逻辑及系统性思维能力；5.有良好的团队合作精神和沟通能力，具备良好的分析思路并善于学习和思考。【棒谷提供】1、薪酬：综合薪资5-8K；2、专业培训：专业的培训队伍，为每位新入职员工提供系统的技能培训、职业培训、户外拓展；3、福利待遇：五险一金/绩效奖金/全勤奖/创新奖/年终奖/入职体检/企业文化活动/拓展培训/优秀团队活动经费/大型年会/达标旅游/节日礼物/下午茶；4、带薪假期：带薪年假（5-7天）、国家法定节假日、婚假、产假等；5、工作氛围：开放、轻松、年轻、扁平化管理。,本科,计算机/互联网,职位诱惑：五险一金/绩效奖金/全勤奖/创新奖/入职体检/企业文化活动,数据分析专员,5天／周,实习7个月,208-333／天,2000人以上,https://www.shixiseng.com/intern/inn_pdhjjvabzo4z
北京,北京,一点资讯,职位描述：1、辅助完成数据提取和整理工作；2、制作常规的数据报告；3、根据项目需要，制作数据研究报告。任职要求：1、统计、广告类相关专业本科及以上学历；2、能够熟练使用EXCEL和PPT；3、良好的数据敏感度与逻辑分析能力，具备良好的沟通能力、团队精神。4、会SQL、hive的优先考虑。1、150-180rmb/日薪2、互联网领域的实习经验3、自由的成长空间，转正机会,本科,计算机/互联网,职位诱惑：福利待遇好 双休 有转正机会 工资高,数据分析实习生,5天／周,实习4个月,150-180／天,500-2000人,https://www.shixiseng.com/intern/inn_hxwrsy6m8mnv
成都,北京,麦可思,职位描述：【岗位职责】1.负责各类常规项目数据分析，根据数据分析结果撰写相应分析报告；2.参与定制化项目设计，根据客户需求，挖掘数据信息，撰写相应的分析报告。【任职资格】1.社会学、统计学、应用数学、信息与计算科学等相关专业本科及以上学历；2.有相关实习或工作经验者优先；3.熟悉Office软件的常用功能，尤其熟练运用Word和PowerPoint编辑、排版，Excel图表及数据分析，会操作常用统计软件者优先；4.注重细节，对数字敏感，逻辑性强，具备快速学习和分析能力。,本科,教育/培训,职位诱惑：行业领军企业,数据分析员,5天／周,实习3个月,80-100／天,150-500人,https://www.shixiseng.com/intern/inn_qfezkbyctxad
上海,上海,长江众创,职位描述：岗位职责：1、负责海量影视相关数据的挖掘、分析工作；2、在分布式的大数据平台上研究从事数据挖掘、自然语言处理、机器学习等工作；3、负责科学算法的应用工作，结合产品需求，提出指导方案；4、对公司原有产品中的算法提出改进意见，让数据挖掘更准确；5、参与数据建模、算法研究等工作。岗位要求：1、计算机、信息管理、统计、数学及相关专业本科学历以上；2、具备机器学习、自然语言处理、海量数据挖掘、文本处理、海量检索之一经验；3、至少熟悉Java、Python、R等一门语言，动手能力强，有实践经验优先考虑；4、有Spark、Hadoop、NoSQL、SQL技术应用经验的优先考虑；5、有影视数据分析经验的优先考虑；6、一周3天或以上，实习期至少6个月以上，优秀者可留用。,本科,计算机/互联网,职位诱惑：新平台、新挑战、新机遇,数据分析师,3天／周,实习6个月,150-200／天,50-150人,https://www.shixiseng.com/intern/inn_0zghvkbpqmqz
上海,上海,长江众创,职位描述：职位描述：岗位职责：1、协助数据库架构师数据库清洗规则调研2、数据清洗调研3、配合其他部门进行的数据处理、查询，统计和分析工作。4、项目经理交代的其他工作任职资格：1、本科及以上学历，计算机、应用数学、统计、运筹学相关专业优先；2、具有良好的逻辑分析能力与表达沟通能力，快速的学习能力和业务理解能力，文档整理规范、条理清晰；3、对工作有强烈的责任心，对大数据有极大热情。4、在这里你会能接触到数据分析师的数据建模、数据库使用、Python学习的指导5、每周工作3天以上,本科,计算机/互联网,职位诱惑：新平台、新挑战、新机遇,数据调研分析,3天／周,实习4个月,100-150／天,50-150人,https://www.shixiseng.com/intern/inn_bpva2nij87gb
大连,大连,西山居,职位描述：岗位描述1.负责网游运营数据的整理和分析工作，提交相关数据分析报告2.为运营决策，产品设计等方面提供数据支持和参考3.负责同开发等其他部门同事沟通并解决相关数据问题4.协助建设和完善公司内数据挖掘分析平台5.负责行业内情报信息的搜集和对应的数据整理分析任职要求1.有非常丰富的游戏经历，热爱游戏2.计算机、数学、数理统计等专业优先3.熟练使用Excel、SPSS等数据分析工具4.熟练掌握SQL语句5.具有对数据的高度敏感度和耐心、严谨、细致的工作态度6.具有严谨的逻辑思维能力和优秀的学习能力注：如果你热爱游戏，诚挚的想加入游戏行业，请在你的简历中说明，比如你的游戏经历等和游戏有关的内容。,本科,计算机/互联网,职位诱惑：一对一导师制、实习补贴、免费宿舍、餐饮补助等,数据分析师(实习生),5天／周,实习13个月,100-150／天,150-500人,https://www.shixiseng.com/intern/inn_xn7hlmdchhbe
广州,广州,广发基金,职位描述：岗位职责:1、负责公司经营分析相关的数据开发和处理工作；2、参与基金行业数据分析工作。任职资格:1.熟练使用SQl语句，掌握python或者R，；2.有良好的数据分析意识和开发能力。3.每周3天以上，需至少实习2个月以上。注：本岗位暂无留用机会。,硕士,金融,职位诱惑：基金公司大平台学习机会,数据分析实习生,3天／周,实习3个月,100-120／天,150-500人,https://www.shixiseng.com/intern/inn_obw1msls83yl
北京,北京,阳光保险集团,职位描述：岗位职责：1.基于数据分析进行业务洞察，发现各类运营问题和新业务机会，提供改进优化建议和业务决策，提升或创造商业价值；2.构建业务分析的策略，参与整体数据系统的设计、开发和落地3.负责项目的需求调研、数据分析、商业分析及数据挖掘建模等工作；4.根据实际业务要求，完成较深入的专项数据分析并形成分析报告；5.独立研究数据挖掘模型，参与数据挖掘模型的构建、维护、部署和评估工作。任职要求：1.第一学历为985/211学校本科；最高学历为硕士及以上；2.计算机、数学、统计学、数据挖掘、数量经济学等专业；3.熟悉数据统计和数据建模，有海量数据分析经验，熟练使用SAS、SPSS或R语言，专业的SQL、Excel操作技巧；4.有优秀的数据分析能力和需求分析能力，较好的业务理解能力，能够独立开展业务调研、数据分析、报告编写工作；5.了解hadoop、hive、分布式数据仓库者优先。,硕士,金融/保险,职位诱惑：发展前景,未来之星-集团大数据分析实习生,5天／周,实习3个月,120-150／天,2000人以上,https://www.shixiseng.com/intern/inn_eehpgaqcps72
广州,北京,东方国信,"职位描述：该职位接受暑期实习&长期实习。职位描述招聘人数：8人实习天数：4天/周职位职责：基本要求：1、一本高校，211或985高校优先2、专业不限，大三保研/研一/研二优先，熟悉SQL者优先，有统计学、计算机专业背景、编程或数据处理经验者优先3、实习地点主要为广州，根据项目需要，接受适当出差（或实习地点直接在出差地点东莞、深圳等省内城市）4、实习时间至少为6个月,每周可实习时间至少4天（不含周末），根据工作进度会有适当加班5、为人踏实，愿意从事基础数据处理工作6、思维活跃，在进行数据分析和挖掘工作时积极参与到团队讨论中并乐于提出想法7、数字敏感性强，喜欢数据挖掘工作8、进取心强，愿意不断学习业务知识、各类数据分析、建模技能工作内容：1、基础数据处理与分析2、分析数据，更新各类报表3、配合业务人员，通过大数据解读用户行为，提出业务建议4、配合建模人员进行大数据挖掘与建模实习收获与待遇1、数据分析工作的技能与方法2、大数据分析与挖掘经验，行业领先解决问题的方法3、获得东方国信实习证明，表现优异者将获得转正资格。4、实习薪资本科2500元/月，研究生3500元/月",本科,"计算机/互联网,通信",职位诱惑：获得东方国信实习证明，表现优异者将获得转正资格,数据分析实习生,3天／周,实习12个月,110-150／天,2000人以上,https://www.shixiseng.com/intern/inn_1nfxlesmn4xt
广州,北京,东方国信,"职位描述：【岗位职责】1.学习数据库开发、java开发、数据挖掘及大数据开发技术；2.学习本地项目业务流程，完成基本开发任务；3.负责客户意见反馈与问题跟踪，自行解决简单问题；4.实习期满视个人能力及工作意愿转相应开发岗位。【岗位要求】1.具有全日制普通高等院校本科(含)在读生或应届毕业生，计算机、软件、数学、统计等相关专业；2.对软件开发有浓厚兴趣，有志于投身民族软件事业；3.有良好的沟通与团队合作精神，有较强的分析解决问题的能力；4.熟悉一种或几种主流数据库，如Oracle,Hive,Mysql,SQLServer等并且能熟练编写SQL语句（数据库开发方向）；5.熟悉数理统计原理，熟悉R、CLEMENTINE、SAS等（数据分析挖掘方向）；6.熟悉java、JSP、javascript和HTML、XML（java开发方向）；",本科,计算机/互联网,职位诱惑：转正后13薪+年终奖+六险一金+节日礼品+员工体检等,实习工程师岗位（JAVA开发、数据开发、数据分析挖掘方向),5天／周,实习12个月,115-200／天,2000人以上,https://www.shixiseng.com/intern/inn_ajuh2mednnzp
上海,上海,快牛金科,职位描述：【岗位职责】1.运用数据分析/统计学习的理论和方法，深入挖掘和分析用户行为、业务数据；2.定期完成量化的工作任务，独立负责和解决所负责的任务；3.与团队内部以及需求部门进行有效沟通，跟进项目进度以及解决相关数据问题。【岗位要求】1.大三大四或研一研二在读学生（也接受应届生），统计学、金融学、市场营销或计算机相关专业；2.逻辑思维强，有独立思考能力，考虑问题全面、细心；3.一周保证能够正常到岗4天及以上。,本科,"计算机/互联网,金融",职位诱惑：大牛带队、快速成长、接触全面,数据分析助理,4天／周,实习13个月,200-280／天,500-2000人,https://www.shixiseng.com/intern/inn_vnzyrabua2c4
北京,北京,柠檬微趣,职位描述：该职位接受暑期实习。工作职责：1、开发和维护自动数据统计分析脚本2、开发和维护数据ETLpipeline保证数据导入及时准确3、管理大数据平台数据组织结构任职要求：1、精通SQL2、熟悉bash等shell脚本语言3、有复杂SQL查询经验者优先,不限,计算机/互联网,职位诱惑：牛人多，福利好，给最大的成长空间,数据分析,3天／周,实习3个月,150-250／天,50-150人,https://www.shixiseng.com/intern/inn_tlfhpvtml3gt
上海,上海,贝塔斯曼,职位描述：欧唯特“模范生加速发展计划”面向上海各大高校优秀学生，是为2018年将毕业的你量身打造的校园项目。你将由我司经理级别以上人员直接带教，接受定制培训，参与项目实战，如被录用，三年后的你即有机会晋升为经理级别人员。在欧唯特，你可以有:1.高颜值的小伙伴和温馨和谐的团队氛围;2.高大上的办公环境;3.福利大礼包，包括但不限于节日礼物，年度旅游，免费健身房岗位职责：1.利用公司运营数据以及专业分析工具(SQL)对公司网站数据进行深入分析，提出解决方案。2.探究用户行为习惯特征，优化公司产品收益。3.为客户提供可行性研究，形成报告(Excel&amp;PPT)。4.与其他部门共同沟通、讨论，进而高效解决问题。岗位要求：1.本科以上学历，数学/统计/计算机相关专业背景，有意向往运营及数据分析方向发展。2.思路严谨，专注力强，逻辑性强。3.基本数据处理能力，熟练使用常见的统计分析软件(SQL/Excel等)，SQL语句熟练者优先。4.良好的理解能力、人际沟通能力和报告撰写能力。,本科,企业服务,职位诱惑：德企500强 可留用 环境高大上,管理培训生(数据分析方向),5天／周,实习12个月,120-121／天,500-2000人,https://www.shixiseng.com/intern/inn_jbiine4afyuw
